{
  "schema_version": "3.0.0",
  "generated_at": "2026-08-16T04:37:51.285319Z",
  "current_release_id": "2026-07",
  "releases": [
    {
      "release_id": "2026-07",
      "data_through_label": "July 2026",
      "published_at": "2026-08-15",
      "status": "current",
      "methodology_version": "v0.1.12",
      "summary": "Economic pressure fell modestly in July 2026. Higher-income households faced more pressure than lower-income households, and the Income Pressure Spread narrowed slightly from the prior month. The labor-market backdrop improved slightly, with unemployment edging down to 4.1%.",
      "summary_facts": {
        "lower_income_more_pressure": false,
        "higher_income_more_pressure": true,
        "pressure_similar_across_bottom_top": false,
        "most_pressured_group": "Q4",
        "least_pressured_group": "Q1",
        "median_delta_mom": -0.27678480117446824,
        "stress_delta_mom": -0.28426364528287884,
        "spread_delta_mom": -0.03776332871727739,
        "tilt_delta_mom": 0.03259818953309512,
        "unemployment_delta_mom": -0.10000000000000053,
        "overall_direction": "fell_modestly",
        "spread_direction": "spread_narrowed_slightly"
      },
      "release_note": "/data/outputs/releases/2026-07.html",
      "spec_urls": {
        "baseline": {
          "csv": "/data/outputs/dmi-2026-07-baseline.csv",
          "parquet": "/data/outputs/dmi-2026-07-baseline.parquet"
        },
        "slack_plus": {
          "csv": "/data/outputs/dmi-2026-07-slack_plus.csv",
          "parquet": "/data/outputs/dmi-2026-07-slack_plus.parquet"
        }
      },
      "metrics": {
        "dmi_median": 7.516957462855907,
        "dmi_stress": 7.552376716747651,
        "income_pressure_spread": 0.18013808520687125,
        "income_pressure_tilt": -0.16977719669806213,
        "most_pressured_group": "Q4",
        "least_pressured_group": "Q1",
        "unemployment": 4.1
      }
    }
  ]
}